{"blocks":[10,10,10,10,10,10,9,11,16,10,10,9,9,9,10,10,9,9,9,10,10,10,13,10,10],"border":10,"cells":[[0,0,0,0,0,0,0,0,0,0],[0,0,0,0,0,0,0,0,0,0],[0,0,1,1,1,1,1,2081,0,0],[0,0,1,1,64,64,1,1,0,0],[0,0,1,1,1,1,1,1,0,0],[0,0,1,1,1,1,1,1,0,0],[0,0,1,1,1,1,1,1,0,0],[0,0,1,1,1,1,1,1,0,0],[0,0,0,0,2049,2049,0,0,0,0],[0,0,0,0,0,0,0,0,0,0]],"connections":{},"dark":false,"height":5,"id":"TEST_HOUSE","index":37,"lastMap":"TEST_TOWN","objects":[{"hidden":false,"index":1,"movement":"STAY","name":"TESTHOUSE_MOM","range":"LEFT","sprite":"SPRITE_TEST_MOM","x":6,"y":4}],"outside":false,"palette":"TEST_PALETTE","parent":{"map":"TEST_TOWN","warp":1,"x":5,"y":5},"signs":[],"surface":false,"tileset":"TEST","warps":[{"to":"LAST_MAP","warp":1,"x":4,"y":8},{"to":"LAST_MAP","warp":1,"x":5,"y":8},{"to":"TEST_HOUSE_2F","warp":1,"x":7,"y":2}],"width":5}